{
  "schema_version": "1.0",
  "request_id": "L05-e8afd8818f1e",
  "backend": "deepseek",
  "model": "deepseek-v4-pro",
  "status": "incomplete",
  "reason": "MODEL_UNAVAILABLE",
  "message": "MODEL_UNAVAILABLE",
  "missing_fields": [],
  "task_plan": [],
  "execution_steps": [],
  "tool_results": [],
  "current_revision": null,
  "candidate": null,
  "total_units": null,
  "saved_plan": null,
  "usage": {
    "model_requests": 1,
    "action_calls": 0,
    "input_tokens": null,
    "output_tokens": null,
    "api_cost_usd": null
  },
  "limits": {
    "max_model_requests": 32,
    "max_action_calls": 24,
    "max_revisions": 4,
    "remaining_model_requests": 31,
    "remaining_action_calls": 24
  },
  "warnings": [],
  "trace_path": "C:\\Users\\11250\\Desktop\\xiaoying\\examples\\live\\budget-replan\\20261031T090339Z-1bcb71ad\\L05\\trace.jsonl",
  "manifest": {
    "aliases_sha256": "d353edc86510a18f4b09c4fd41eb3695db209267b3182a3188bb4663bb617e66",
    "catalog_sha256": "27f37e2c51fc25533b3d719f4b82a9cfe637a164d419fb0b3b54c4bc167c5864",
    "model_id": "deepseek-v4-pro",
    "planner_prompt_version": "planner-v1",
    "pricing_sha256": "65382bec23e207f48ef1fd7ec59014ce7cd1e9b8f676a2225174f7d621c5e48f",
    "schema_version": "1.0",
    "script_prompt_version": "script-v1",
    "thinking": "disabled"
  }
}
