{
  "schema_version": "1.0",
  "request_id": "E16-f437f7a73b82",
  "backend": "deepseek",
  "model": "deepseek-v4-pro",
  "status": "incomplete",
  "reason": "tool_failure",
  "message": "脚本生成模型持续不可用（SCRIPT_MODEL_UNAVAILABLE），重试两次后达到工具重试上限，无法生成短视频脚本，因此无法完成影芽剪辑字幕功能推广方案的后续成本估算与保存。",
  "missing_fields": [],
  "task_plan": [],
  "execution_steps": [
    {
      "event_id": 3,
      "operation_id": "tool:call_00_h37mrFrn6rEv8bWIr7M14320",
      "tool_call_id": "call_00_h37mrFrn6rEv8bWIr7M14320",
      "tool": "search_materials",
      "attempt": 1,
      "status": "succeeded",
      "reused": false,
      "result_index": 0,
      "error_code": null
    },
    {
      "event_id": 7,
      "operation_id": "tool:call_00_euOFZ5AAMJfNlCUBEwX68421",
      "tool_call_id": "call_00_euOFZ5AAMJfNlCUBEwX68421",
      "tool": "revise_plan",
      "attempt": 1,
      "status": "succeeded",
      "reused": false,
      "result_index": 1,
      "error_code": null
    },
    {
      "event_id": 11,
      "operation_id": "tool:call_00_tm6AMXhYtVfF29HlDHaf8355",
      "tool_call_id": "call_00_tm6AMXhYtVfF29HlDHaf8355",
      "tool": "generate_script",
      "attempt": 1,
      "status": "failed",
      "reused": false,
      "result_index": 2,
      "error_code": "SCRIPT_MODEL_UNAVAILABLE"
    },
    {
      "event_id": 17,
      "operation_id": "tool:call_00_13xzGpL0RhtE7FiqTHIk8436",
      "tool_call_id": "call_00_13xzGpL0RhtE7FiqTHIk8436",
      "tool": "generate_script",
      "attempt": 2,
      "status": "failed",
      "reused": false,
      "result_index": 3,
      "error_code": "SCRIPT_MODEL_UNAVAILABLE"
    },
    {
      "event_id": 23,
      "operation_id": "tool:call_00_Ty6atqPcnvIlx2Ih64fy0166",
      "tool_call_id": "call_00_Ty6atqPcnvIlx2Ih64fy0166",
      "tool": "generate_script",
      "attempt": 3,
      "status": "rejected",
      "reused": false,
      "result_index": 4,
      "error_code": "TOOL_RETRY_LIMIT_REACHED"
    },
    {
      "event_id": 27,
      "operation_id": "tool:call_00_XazcnhgrrYSIncHDw5L11407",
      "tool_call_id": "call_00_XazcnhgrrYSIncHDw5L11407",
      "tool": "stop_task",
      "attempt": 1,
      "status": "succeeded",
      "reused": false,
      "result_index": 5,
      "error_code": null
    }
  ],
  "tool_results": [
    {
      "tool_call_id": "call_00_h37mrFrn6rEv8bWIr7M14320",
      "tool": "search_materials",
      "ok": true,
      "reused": false,
      "data": {
        "query": "影芽剪辑 字幕功能 推广",
        "catalog_hash": "27f37e2c51fc25533b3d719f4b82a9cfe637a164d419fb0b3b54c4bc167c5864",
        "materials": [
          {
            "material_id": "M01",
            "version": "2026-10-29",
            "title": "影芽剪辑字幕功能",
            "tags": [
              "字幕",
              "自动字幕",
              "字幕编辑"
            ],
            "facts": [
              "影芽剪辑支持自动生成字幕。",
              "自动生成的字幕文本可以编辑。"
            ],
            "fee_units": 1,
            "lead_minutes": 10,
            "score": 1
          }
        ]
      },
      "error": null
    },
    {
      "tool_call_id": "call_00_euOFZ5AAMJfNlCUBEwX68421",
      "tool": "revise_plan",
      "ok": true,
      "reused": false,
      "data": {
        "revision": 1,
        "candidate_hash": "d4e1b2453e8178b2bb8b45208f55e65a943348de23943f87249f4ce46309a72a",
        "material_id": "M01",
        "creative_brief": "推广影芽剪辑字幕功能：突出自动生成字幕与字幕文本可编辑两大卖点，制作一条短视频展示从导入视频到一键生成字幕、再到编辑字幕文本的完整流程，吸引用户使用。",
        "production_mode": "basic",
        "script_input_hash": "e33e8f97fb1199d207d08999e09af19467a3b506b59c2cb07973813d925cf895",
        "script_reused": false,
        "invalidated": []
      },
      "error": null
    },
    {
      "tool_call_id": "call_00_tm6AMXhYtVfF29HlDHaf8355",
      "tool": "generate_script",
      "ok": false,
      "reused": false,
      "data": null,
      "error": {
        "code": "SCRIPT_MODEL_UNAVAILABLE",
        "message": "Script model is unavailable",
        "retryable": true,
        "details": {}
      }
    },
    {
      "tool_call_id": "call_00_13xzGpL0RhtE7FiqTHIk8436",
      "tool": "generate_script",
      "ok": false,
      "reused": false,
      "data": null,
      "error": {
        "code": "SCRIPT_MODEL_UNAVAILABLE",
        "message": "Script model is unavailable",
        "retryable": true,
        "details": {}
      }
    },
    {
      "tool_call_id": "call_00_Ty6atqPcnvIlx2Ih64fy0166",
      "tool": "generate_script",
      "ok": false,
      "reused": false,
      "data": null,
      "error": {
        "code": "TOOL_RETRY_LIMIT_REACHED",
        "message": "Two retryable attempts have already failed",
        "retryable": false,
        "details": {}
      }
    },
    {
      "tool_call_id": "call_00_XazcnhgrrYSIncHDw5L11407",
      "tool": "stop_task",
      "ok": true,
      "reused": false,
      "data": {
        "status": "incomplete",
        "reason": "tool_failure",
        "message": "脚本生成模型持续不可用（SCRIPT_MODEL_UNAVAILABLE），重试两次后达到工具重试上限，无法生成短视频脚本，因此无法完成影芽剪辑字幕功能推广方案的后续成本估算与保存。",
        "evaluated_candidates": [],
        "latest_gap": null,
        "retained_artifact_ids": []
      },
      "error": null
    }
  ],
  "current_revision": 1,
  "candidate": {
    "revision": 1,
    "candidate_hash": "d4e1b2453e8178b2bb8b45208f55e65a943348de23943f87249f4ce46309a72a",
    "material_id": "M01",
    "creative_brief": "推广影芽剪辑字幕功能：突出自动生成字幕与字幕文本可编辑两大卖点，制作一条短视频展示从导入视频到一键生成字幕、再到编辑字幕文本的完整流程，吸引用户使用。",
    "production_mode": "basic",
    "script_input_hash": "e33e8f97fb1199d207d08999e09af19467a3b506b59c2cb07973813d925cf895"
  },
  "total_units": null,
  "saved_plan": null,
  "usage": {
    "model_requests": 8,
    "action_calls": 6,
    "input_tokens": null,
    "output_tokens": null,
    "api_cost_usd": null
  },
  "limits": {
    "max_model_requests": 32,
    "max_action_calls": 24,
    "max_revisions": 4,
    "remaining_model_requests": 24,
    "remaining_action_calls": 18
  },
  "warnings": [],
  "trace_path": "C:\\Users\\11250\\Desktop\\xiaoying\\examples\\live\\core20\\20261031T110356Z-93ca1d21\\E16\\trace.jsonl",
  "manifest": {
    "aliases_sha256": "d353edc86510a18f4b09c4fd41eb3695db209267b3182a3188bb4663bb617e66",
    "catalog_sha256": "27f37e2c51fc25533b3d719f4b82a9cfe637a164d419fb0b3b54c4bc167c5864",
    "model_id": "deepseek-v4-pro",
    "planner_prompt_version": "planner-v1",
    "pricing_sha256": "65382bec23e207f48ef1fd7ec59014ce7cd1e9b8f676a2225174f7d621c5e48f",
    "schema_version": "1.0",
    "script_prompt_version": "script-v1",
    "thinking": "disabled"
  }
}
